{
  "contract_version": "v1",
  "acceptance_id": "acceptance_v1_01J8Q3Z4R5T6V7W8X9Y0ABCDEF",
  "recommendation_id": "recommendation_v1_01J8Q3Z4R5T6V7W8X9Y0ABCDEF",
  "checkin_id": "checkin_v1_01J8Q3Z4R5T6V7W8X9Y0ABCDEF",
  "subject_ref": "subject_v1_01J8Q3Z4R5T6V7W8X9Y0ABCDEF",
  "task_brief_ref": "task_v1_01J8Q3Z4R5T6V7W8X9Y0ABCDEF",
  "intent_ref": "intent_v1_01J8Q3Z4R5T6V7W8X9Y0ABCDEF",
  "trace_id": "trace_v1_01J8Q3Z4R5T6V7W8X9Y0ABCDEF",
  "accepted_at": "2026-07-31T09:00:02Z",
  "operation_class": "mutating",
  "expected_recommendation_status": "proposed",
  "approval_ref": "approval_v1_01J8Q3Z4R5T6V7W8X9Y0ABCDEF",
  "idempotency_key": "accept:recommendation_v1_01J8Q3Z4R5T6V7W8X9Y0ABCDEF",
  "parameter_digest": "sha256:0123456789abcdef0123456789abcdef0123456789abcdef0123456789abcdef",
  "timeout_seconds": 60,
  "cost_limit": {
    "max_cost_minor": 10,
    "currency": "EUR",
    "quote_ref": "quote_v1_01J8Q3Z4R5T6V7W8X9Y0ABCDEF",
    "approval_ref": "approval_v1_01J8Q3Z4R5T6V7W8X9Y0ABCDEF"
  }
}
